{
  "open_condo":{"schema_version":"0.2.0","exported_at":"2026-08-15T12:00:00-06:00","export_id":"export_v02_demo","generator":{"name":"Open Condo demo","version":"0.2.0"}},
  "condominium":{"schema_version":"0.1.0","id":"cond_demo_001","name":"Residencial Valle Central","status":"active","country":"MX","timezone":"America/Mexico_City","currency":"MXN","address":{"state":"Querétaro","municipality":"Querétaro","country":"MX"},"created_at":"2026-01-01T09:00:00-06:00","updated_at":"2026-08-15T11:59:00-06:00"},
  "units":[{"schema_version":"0.1.0","id":"unit_a_302","condominium_id":"cond_demo_001","display_name":"Torre A · 302","type":"apartment","status":"active","created_at":"2026-01-01T09:00:00-06:00","updated_at":"2026-08-15T11:00:00-06:00"}],
  "people":[{"schema_version":"0.1.0","id":"person_demo_001","name":{"display_name":"María Fernanda Gómez Ejemplo"},"status":"active","created_at":"2026-01-01T09:00:00-06:00","updated_at":"2026-08-15T11:00:00-06:00"}],
  "occupancies":[{"schema_version":"0.1.0","id":"occupancy_demo_001","condominium_id":"cond_demo_001","unit_id":"unit_a_302","person_id":"person_demo_001","role":"owner","status":"active","is_primary_contact":true,"valid_from":"2026-01-01","valid_until":null,"created_at":"2026-01-01T09:00:00-06:00","updated_at":"2026-08-15T11:00:00-06:00"}],
  "charges":[],
  "payments":[],
  "amenities":[{"schema_version":"0.2.0","id":"amenity_padel_01","condominium_id":"cond_demo_001","name":"Cancha de pádel","type":"sports_court","status":"active","reservation_mode":"required","timezone":"America/Mexico_City","capacity":4,"resources":[{"id":"court_1","name":"Cancha 1","status":"active","capacity":4}],"rule_set_ids":["rules_padel_usage","rules_padel_pricing"],"created_at":"2026-08-01T08:00:00-06:00","updated_at":"2026-08-15T08:00:00-06:00"}],
  "rule_sets":[
    {"schema_version":"0.2.0","id":"rules_padel_usage","condominium_id":"cond_demo_001","name":"Reglas de uso de pádel","scope":"reservation_creation","status":"active","effective_from":"2026-08-01T00:00:00-06:00","effective_until":null,"conflict_strategy":"deny_overrides","rules":[
      {"id":"rule_open_hours","name":"Horario permitido","priority":100,"when":{"not":{"left":{"function":"day_of_week","arguments":[{"path":"$.reservation.starts_at"}]},"operator":"in","right":{"value":["monday","tuesday","wednesday","thursday","friday","saturday","sunday"]}}},"effects":[{"type":"deny","code":"OUTSIDE_OPEN_DAYS","message":"La amenidad no está disponible ese día."}]},
      {"id":"rule_duration","name":"Duración de 90 minutos","priority":90,"when":{"left":{"function":"minutes_between","arguments":[{"path":"$.reservation.starts_at"},{"path":"$.reservation.ends_at"}]},"operator":"neq","right":{"value":90}},"effects":[{"type":"deny","code":"INVALID_DURATION","message":"Las reservaciones deben durar 90 minutos."}]},
      {"id":"rule_advance","name":"Máximo tres días de anticipación","priority":80,"when":{"left":{"function":"days_between","arguments":[{"function":"now","arguments":[]},{"path":"$.reservation.starts_at"}]},"operator":"gt","right":{"value":3}},"effects":[{"type":"deny","code":"ADVANCE_LIMIT","message":"Solo puede reservarse con tres días de anticipación."}]},
      {"id":"rule_debt","name":"Sin adeudo vencido","priority":110,"when":{"left":{"path":"$.unit.financial.overdue_balance.value"},"operator":"gt","right":{"value":0}},"effects":[{"type":"deny","code":"OVERDUE_BALANCE","message":"La unidad tiene saldo vencido."}]},
      {"id":"rule_ack","name":"Aceptar reglamento","priority":70,"when":{"left":{"path":"$.request.acknowledgements.padel_rules"},"operator":"neq","right":{"value":true}},"effects":[{"type":"require_acknowledgement","code":"PADEL_RULES","parameters":{"document_id":"doc_padel_rules_v3"}}]}
    ],"created_at":"2026-08-01T08:00:00-06:00","updated_at":"2026-08-15T08:00:00-06:00"},
    {"schema_version":"0.2.0","id":"rules_padel_pricing","condominium_id":"cond_demo_001","name":"Precio y penalizaciones de pádel","scope":"pricing","status":"active","effective_from":"2026-08-01T00:00:00-06:00","effective_until":null,"conflict_strategy":"collect_all","rules":[
      {"id":"rule_base_price","name":"Tarifa base","priority":10,"when":{"left":{"path":"$.amenity.id"},"operator":"eq","right":{"value":"amenity_padel_01"}},"effects":[{"type":"set_price","parameters":{"amount":{"value":300,"currency":"MXN"},"basis":"per_slot"}}]},
      {"id":"rule_late_cancel","name":"Cancelación tardía","priority":20,"when":{"left":{"function":"minutes_between","arguments":[{"function":"now","arguments":[]},{"path":"$.reservation.starts_at"}]},"operator":"lt","right":{"value":1440}},"effects":[{"type":"set_penalty","code":"LATE_CANCELLATION","parameters":{"amount":{"value":150,"currency":"MXN"}}}]}
    ],"created_at":"2026-08-01T08:00:00-06:00","updated_at":"2026-08-15T08:00:00-06:00"}
  ],
  "reservations":[{"schema_version":"0.2.0","id":"reservation_padel_001","condominium_id":"cond_demo_001","amenity_id":"amenity_padel_01","resource_ids":["court_1"],"unit_id":"unit_a_302","requested_by_person_id":"person_demo_001","starts_at":"2026-08-16T18:00:00-06:00","ends_at":"2026-08-16T19:30:00-06:00","status":"confirmed","party_size":4,"guest_count":2,"source":"resident_app","rule_evaluation":{"evaluated_at":"2026-08-15T12:00:00-06:00","rule_set_ids":["rules_padel_usage","rules_padel_pricing"],"decision":"allowed","applied_rule_ids":["rule_base_price","rule_ack"],"warnings":[],"snapshot":{"engine_version":"0.2.0"}},"created_at":"2026-08-15T12:00:00-06:00","updated_at":"2026-08-15T12:00:00-06:00"}],
  "reservation_charges":[{"schema_version":"0.2.0","id":"reservation_charge_001","condominium_id":"cond_demo_001","reservation_id":"reservation_padel_001","unit_id":"unit_a_302","type":"usage_fee","concept":"Reservación de cancha de pádel","amount":{"value":300,"currency":"MXN"},"status":"pending","rule_set_id":"rules_padel_pricing","rule_id":"rule_base_price","calculation":{"basis":"per_slot","quantity":1,"unit_amount":{"value":300,"currency":"MXN"}},"due_at":"2026-08-16T18:00:00-06:00","refundable":true,"refundable_until":"2026-08-15T18:00:00-06:00","created_at":"2026-08-15T12:00:00-06:00","updated_at":"2026-08-15T12:00:00-06:00"}]
}